{
  "candidate_id": "baseline-mo-sfmo",
  "candidate_version": "1.0",
  "change_summary": "Protected initial incumbent: archive-based multi-objective extension retaining repeated SFMO grazing, collective migration, and compensation.",
  "changed_paths": [],
  "code_reference": "sha256:e2d68774363bddb9e1ce673333960c5f045b7a839ee9343c1020508ea17f6f1c:research/baselines.py",
  "contract_fingerprint": "3e605a2918f27fe21754b5a1a7a94e6e62b19bc7c592d70684d28f0fc4499135",
  "created_at": "2026-09-08T07:19:07.542599Z",
  "decision": {
    "decided_at": "2026-09-08T07:19:07.542599Z",
    "reason": "Initial baseline passed all ten baseline-validation gates and defines the starting incumbent.",
    "state": "ACCEPT"
  },
  "extensions": {},
  "hypothesis_id": "initial-baseline",
  "parent_candidate_id": null,
  "result_refs": [
    ".autoresearch/results/static/baseline-static-validation.json",
    ".autoresearch/results/smoke/baseline-determinism.json"
  ],
  "status": "accepted",
  "verification": {
    "deterministic_runs": 12,
    "nfe": 24000,
    "report": ".autoresearch/reports/baseline-validation.md",
    "unit_tests": "6 passed"
  }
}
