{
  "candidate_id": "C001-one-shot",
  "candidate_version": "1.0",
  "change_summary": "Replace repeated multi-grazing and repeated collective migration with exactly one stagnation-aware grazing, migration, or regrouping candidate per sheep per cycle; retain population, archive, step schedules, and constraint handling.",
  "changed_paths": [
    "mosfmo/algorithm.py"
  ],
  "code_reference": "sha256:594cc68884ce544e939f348b4ac9ee35ff453cff8bee655124c72a14150f71e8:mosfmo/algorithm.py",
  "contract_fingerprint": "3e605a2918f27fe21754b5a1a7a94e6e62b19bc7c592d70684d28f0fc4499135",
  "created_at": "2026-09-08T07:23:02.305540Z",
  "decision": {
    "decided_at": "2026-09-08T07:28:46.800343Z",
    "reason": "Intermediate accuracy improved strongly, but median runtime regressed by about 333 percent and violated the locked 10 percent runtime non-inferiority threshold.",
    "state": "REJECT"
  },
  "extensions": {
    "intermediate_mean_hv_ratio": 2.7040971065870987,
    "intermediate_mean_igd_ratio": 0.28368506364662194,
    "intermediate_runtime_ratio": 4.328945814090828
  },
  "hypothesis_id": "H001-one-shot-behavior",
  "parent_candidate_id": "baseline-mo-sfmo",
  "result_refs": [
    "results/smoke/C001-one-shot.json",
    "results/quick/C001-one-shot.json"
  ],
  "status": "rejected",
  "verification": {
    "deterministic_candidate_smoke": true,
    "protected_integrity": true,
    "strict_nfe": true,
    "unit_tests": "6 passed"
  }
}
